{"files":[{"change":"added","current":{"mode":493,"sha256":"b1b1b1b1b1b1b1b1b1b1b1b1b1b1b1b1b1b1b1b1b1b1b1b1b1b1b1b1b1b1b1b1"},"path":".hidden/tool","previous":null},{"change":"content_changed","current":{"mode":420,"sha256":"b2b2b2b2b2b2b2b2b2b2b2b2b2b2b2b2b2b2b2b2b2b2b2b2b2b2b2b2b2b2b2b2"},"path":"manifest.json","previous":{"mode":420,"sha256":"a1a1a1a1a1a1a1a1a1a1a1a1a1a1a1a1a1a1a1a1a1a1a1a1a1a1a1a1a1a1a1a1"}},{"change":"content_changed","current":{"mode":493,"sha256":"b3b3b3b3b3b3b3b3b3b3b3b3b3b3b3b3b3b3b3b3b3b3b3b3b3b3b3b3b3b3b3b3"},"path":"plugin/main.sh","previous":{"mode":493,"sha256":"a2a2a2a2a2a2a2a2a2a2a2a2a2a2a2a2a2a2a2a2a2a2a2a2a2a2a2a2a2a2a2a2"}}],"fresh_consent_required":true,"plugin_id":"unchanged","previous_publisher_evidence_sha256":"806cf69774e45b517df08bf876cedea9706816dde6666db0d6c03baecd993b97","previous_structural_record_sha256":"f4caef8f867d071633c7713bd40d988f4f53207de2c513c00d69d3696f3112ca","previous_subject":{"analysis_stream_schema":"a-quo-regular-file-stream-v1","analysis_stream_sha256":"a9a9a9a9a9a9a9a9a9a9a9a9a9a9a9a9a9a9a9a9a9a9a9a9a9a9a9a9a9a9a9a9","analysis_stream_size":158,"artifact_sha256":"a0a0a0a0a0a0a0a0a0a0a0a0a0a0a0a0a0a0a0a0a0a0a0a0a0a0a0a0a0a0a0a0","artifact_size":100,"manifest_sha256":"a1a1a1a1a1a1a1a1a1a1a1a1a1a1a1a1a1a1a1a1a1a1a1a1a1a1a1a1a1a1a1a1","package_format":"omarchy-zstd-tar-v1","plugin_id":"org.a-quo.oracle","plugin_version":"2.0.0"},"providers":[{"current_native_report_sha256":"c2c2c2c2c2c2c2c2c2c2c2c2c2c2c2c2c2c2c2c2c2c2c2c2c2c2c2c2c2c2c2c2","previous_native_report_sha256":"c1c1c1c1c1c1c1c1c1c1c1c1c1c1c1c1c1c1c1c1c1c1c1c1c1c1c1c1c1c1c1c1","provider_id":"oracle.static"}],"publisher_continuity":"matched","publisher_evidence_sha256":"331f30eac9946f09733e492619173af71c627f9ce7154244f91ebf755e03612d","schema":"urn:a-quo:omarchy-plugin-update-delta:v1","structural_record_sha256":"7d6f3ce0328d0bccc2fb0f72f963a9ec7b5101f7d4607ca18f8167c1df7b353e","subject":{"analysis_stream_schema":"a-quo-regular-file-stream-v1","analysis_stream_sha256":"b9b9b9b9b9b9b9b9b9b9b9b9b9b9b9b9b9b9b9b9b9b9b9b9b9b9b9b9b9b9b9b9","analysis_stream_size":223,"artifact_sha256":"b0b0b0b0b0b0b0b0b0b0b0b0b0b0b0b0b0b0b0b0b0b0b0b0b0b0b0b0b0b0b0b0","artifact_size":120,"manifest_sha256":"b2b2b2b2b2b2b2b2b2b2b2b2b2b2b2b2b2b2b2b2b2b2b2b2b2b2b2b2b2b2b2b2","package_format":"omarchy-zstd-tar-v1","plugin_id":"org.a-quo.oracle","plugin_version":"2.1.0"},"version":"upgrade"}