{"files":[{"change":"added","current":{"mode":493,"sha256":"9999999999999999999999999999999999999999999999999999999999999999"},"path":".hidden/tool","previous":null},{"change":"content_changed","current":{"mode":420,"sha256":"3333333333333333333333333333333333333333333333333333333333333333"},"path":"manifest.json","previous":{"mode":420,"sha256":"1111111111111111111111111111111111111111111111111111111111111111"}},{"change":"content_changed","current":{"mode":493,"sha256":"4444444444444444444444444444444444444444444444444444444444444444"},"path":"plugin/main.sh","previous":{"mode":493,"sha256":"2222222222222222222222222222222222222222222222222222222222222222"}}],"fresh_consent_required":true,"plugin_id":"unchanged","previous_publisher_evidence_sha256":"5d5c9ec9978c266ebea814366636bd3adf502667a2d2a3dcec75701a85ffcfcd","previous_structural_record_sha256":"f290bdb3c6d593e436ae21de5b7ff46f957ce31955ae4fee4e2a8d525789017a","previous_subject":{"analysis_stream_schema":"a-quo-regular-file-stream-v1","analysis_stream_sha256":"bbbbbbbbbbbbbbbbbbbbbbbbbbbbbbbbbbbbbbbbbbbbbbbbbbbbbbbbbbbbbbbb","analysis_stream_size":158,"artifact_sha256":"aaaaaaaaaaaaaaaaaaaaaaaaaaaaaaaaaaaaaaaaaaaaaaaaaaaaaaaaaaaaaaaa","artifact_size":100,"manifest_sha256":"1111111111111111111111111111111111111111111111111111111111111111","package_format":"omarchy-zstd-tar-v1","plugin_id":"test.risk-contract","plugin_version":"1.0.0"},"providers":[{"current_native_report_sha256":"7777777777777777777777777777777777777777777777777777777777777777","previous_native_report_sha256":"6666666666666666666666666666666666666666666666666666666666666666","provider_id":"static.analysis"}],"publisher_continuity":"matched","publisher_evidence_sha256":"511cd29535df69297531f6b1a2107f5d208dde6c61c87e1f746be50c0bd96f44","schema":"urn:a-quo:omarchy-plugin-update-delta:v1","structural_record_sha256":"2ffc171f47ac80280bbecbb425f1ab5ad497401e2db588b793853a5f9fa78118","subject":{"analysis_stream_schema":"a-quo-regular-file-stream-v1","analysis_stream_sha256":"dddddddddddddddddddddddddddddddddddddddddddddddddddddddddddddddd","analysis_stream_size":223,"artifact_sha256":"cccccccccccccccccccccccccccccccccccccccccccccccccccccccccccccccc","artifact_size":120,"manifest_sha256":"3333333333333333333333333333333333333333333333333333333333333333","package_format":"omarchy-zstd-tar-v1","plugin_id":"test.risk-contract","plugin_version":"1.1.0"},"version":"upgrade"}